{
  "$schema": "https://json-schema.org/draft/2020-12/schema",
  "$id": "https://cardnarrative/schemas/prologue.schema.json",
  "title": "Prologue Card",
  "type": "object",
  "required": [
    "moduleName", "difficulty", "openingNarrative",
    "winConditions", "loseConditions", "difficultyCurve",
    "startingTileId", "importantTileIds",
    "characterUpgradeThreshold", "scoreFormula"
  ],
  "properties": {
    "moduleName": { "type": "string" },
    "difficulty": { "type": "integer", "minimum": 1, "maximum": 5 },
    "openingNarrative": { "type": "string" },
    "winConditions": {
      "type": "array",
      "items": {
        "oneOf": [
          { "type": "object", "required": ["type", "key", "value"],
            "properties": {
              "type": { "const": "flag" },
              "key": { "type": "string" },
              "value": {}
            },
            "additionalProperties": false }
        ]
      }
    },
    "loseConditions": {
      "type": "array",
      "items": {
        "oneOf": [
          { "type": "object", "required": ["type", "value"],
            "properties": {
              "type": { "const": "turnLimit" },
              "value": { "type": "integer", "minimum": 1 }
            },
            "additionalProperties": false },
          { "type": "object", "required": ["type"],
            "properties": { "type": { "const": "allPlayersDown" } },
            "additionalProperties": false }
        ]
      }
    },
    "difficultyCurve": {
      "type": "object",
      "required": ["early", "middle", "climax"],
      "properties": {
        "early":  { "$ref": "#/$defs/difficultyRange" },
        "middle": { "$ref": "#/$defs/difficultyRange" },
        "climax": {
          "type": "object",
          "required": ["baseTn", "perFailureTnIncrease", "tnCap"],
          "properties": {
            "baseTn": { "type": "integer" },
            "perFailureTnIncrease": { "type": "integer" },
            "tnCap": { "type": "integer" }
          }
        }
      }
    },
    "startingTileId": { "type": "string" },
    "importantTileIds": { "type": "array", "items": { "type": "string" } },
    "characterUpgradeThreshold": { "type": "integer", "minimum": 1 },
    "scoreFormula": { "type": "string" },
    "winConditionLabels": {
      "description": "S1 開場序幕 overlay 顯示用：將 winCondition.key 映射到中文標籤。",
      "type": "object",
      "additionalProperties": { "type": "string" }
    },
    "loseConditionLabels": {
      "description": "S1 開場序幕 overlay 顯示用：將 loseCondition type（turnLimit / allPlayersDown）映射到中文標籤。",
      "type": "object",
      "additionalProperties": { "type": "string" }
    },
    "startingCompanionIds": {
      "description": "Phase 2 任務 11 Stage 1：起手陣容同伴 ID 清單（對應 npc_companions.json 的 id）。runtime 載入時自動指派給玩家；空陣列或缺欄位則無同伴。",
      "type": "array",
      "items": { "type": "string" },
      "minItems": 0,
      "maxItems": 4
    },
    "tileBatches": {
      "description": "Phase 3 v1.12 Stage 3：自訂「3 張選 1」批次抽牌節奏。每組 1-3 張 tile id（重複表 copies）。空陣列 / 缺欄位 fallback 到既有 TileDeck 機械抽 3。",
      "type": "array",
      "items": {
        "type": "array",
        "items": { "type": "string" },
        "minItems": 1,
        "maxItems": 3
      }
    },
    "eventPriorities": {
      "description": "Phase 3 任務 14（S5）：同時命中多事件時的處理順序。清單前面的 event id 先觸發；未列入者依 module 載入序作 fallback。",
      "type": "array",
      "items": { "type": "string" }
    }
  },
  "$defs": {
    "difficultyRange": {
      "type": "object",
      "required": ["tnRange"],
      "properties": {
        "tnRange": {
          "type": "array", "items": { "type": "integer" }, "minItems": 2, "maxItems": 2
        },
        "untilTurn": { "type": "integer" }
      }
    }
  }
}
